{
  "id": "FR-REC-02-FE-03",
  "wbs": "3.2.3",
  "section": "자연어 검색과 개인화 코디 추천",
  "title": "비교 불가 및 데이터 부족 상태 표시",
  "phase": "개발",
  "category": "프론트엔드",
  "responsible": "",
  "assistants": [],
  "startDate": "2026-10-12",
  "endDate": "2026-10-12",
  "weight": 1,
  "progress": null,
  "status": "진행 전",
  "predecessorIds": [],
  "deliverables": [],
  "notes": "[난이도] weight=1; 단일 화면 요소·검증·조회·상태 처리 중심의 개발자 추정.\n[판정] 제공된 완료 21개 목록에 없음. 부분 구현 37개와 구현 근거 없음 88개의 개별 ID는 제공되지 않아 세부 진척률은 미상. weight 전량을 일정에 반영.\n[단계 일정] 경민 담당 영역 1단계: 자연어 검색과 개인화 코디 추천. FE·BE 공통 작업 기간 2026-10-07~2026-10-16. 이전 영역의 진행 전 과업 종료 후 다음 영역 시작. 작업 배정: 2026-10-12: 1일. 시작=오전, 종료=오후. 10/17·10/24는 반일. 등록된 선행 과업은 전 근무일까지 완료.\n[일정 전제] 동일 영역 내 여러 과업을 병행하는 목표일정. 담당자는 백엔드 영역 책임자이며 1인당 동시 작업 한도는 적용하지 않음. weight 1=1인일, 2=2인일을 유지했으므로 실제 실행에는 추가 분담 또는 작업량·기간 조정이 필요함. 프론트 담당자는 미지정. 기존 predecessorIds를 유지했으며 미등록 의존성 및 보류 과업 재개에 따른 일정은 별도 조정 대상."
}
