{
  "id": "FR-PRF-02-BE-02",
  "wbs": "1.4.7",
  "section": "계정과 사용자 프로필",
  "title": "프로필 부분 수정 API 구현 (PATCH, 미전달 필드와 null 필드 구분 처리)",
  "phase": "개발",
  "category": "백엔드",
  "responsible": "",
  "assistants": [],
  "startDate": "2026-10-12",
  "endDate": "2026-10-13",
  "weight": 2,
  "progress": null,
  "status": "진행 전",
  "predecessorIds": [],
  "deliverables": [],
  "notes": "[난이도] weight=2; 복합 상태·트랜잭션·외부 서비스 연동 또는 여러 데이터 처리에 대한 개발자 추정.\n[판정] 프런트엔드 저장소만으로 백엔드 진행 상태 확인 불가. 일정 산정을 위해 작업량 전부를 임시 반영; 확인 후 조정 필요.\n[계획] BE-05 병렬 작업 그룹(실제 담당자 미정). 배정 작업량: 2026-10-12: 1일; 2026-10-13: 1일. 시작=오전, 종료=오후. weight 1=1인일, 2=2인일; 10/17·10/24는 0.5일. 등록된 predecessorIds 기준 선행 과업은 전 근무일까지 완료하도록 배치.\n[일정 전제] 전체 미완료·판정불가 251개를 가용 인원 제한 없이 배치한 목표일정. 이 배치에는 FE 12개·BE 12개 병렬 작업 그룹이 필요하며, 실제 인력 배정 및 미등록 선행관계 검토 후 실행 가능 여부를 확정해야 함. 백엔드의 실제 기완료분은 작업량에서 차감되지 않음."
}
