{
  "id": "FITZZA-48",
  "wbs": "FITZZA-48",
  "section": "FR-REC-01 자연어 조건 해석",
  "title": "추천 결과 및 연계 기능",
  "phase": "FR-REC-01",
  "category": "프론트엔드",
  "responsible": "수혁",
  "assistants": [],
  "startDate": "2026-10-07",
  "endDate": "2026-10-16",
  "weight": 0.007894736842105263,
  "status": "진행 중",
  "predecessorIds": [],
  "deliverables": [],
  "notes": "Jira FITZZA-48 (In Review, 2026-10-14T01:35:55.3895190Z 조회). 기존 WBS 5개 작업의 가중치를 합산했습니다. 원본별 내역: data/jira-weight-audit.json. 날짜는 기존 작업의 최소 시작일·최대 종료일이며 Jira 계획일은 아닙니다."
}
