{
  "id": "FITZZA-129",
  "wbs": "FITZZA-129",
  "section": "FR-VTO-02 피팅 작업 요청 생성",
  "title": "이미지 합성 API 연동 및 피팅 작업 생성",
  "phase": "FR-VTO-02",
  "category": "백엔드",
  "responsible": "경민",
  "assistants": [],
  "startDate": "2026-10-21",
  "endDate": "2026-10-27",
  "weight": 0.012727272727272726,
  "status": "진행 전",
  "predecessorIds": [],
  "deliverables": [],
  "notes": "Jira FITZZA-129 (To Do, 2026-10-14T01:35:55.3895190Z 조회). 기존 WBS 2개 작업의 가중치를 합산했습니다. 원본별 내역: data/jira-weight-audit.json. 날짜는 기존 작업의 최소 시작일·최대 종료일이며 Jira 계획일은 아닙니다."
}
