{
  "id": "FITZZA-103",
  "wbs": "FITZZA-103",
  "section": "FR-COM-03 투표와 참여 내역",
  "title": "투표 마감 및 요청 검증",
  "phase": "FR-COM-03",
  "category": "백엔드",
  "responsible": "지현",
  "assistants": [],
  "startDate": "2026-10-17",
  "endDate": "2026-10-21",
  "weight": 0.003506493506493506,
  "status": "완료",
  "predecessorIds": [],
  "deliverables": [],
  "notes": "Jira FITZZA-103 (Done, 2026-10-14T01:35:55.3895190Z 조회). 기존 WBS 2개 작업의 가중치를 합산했습니다. 원본별 내역: data/jira-weight-audit.json. 날짜는 기존 작업의 최소 시작일·최대 종료일이며 Jira 계획일은 아닙니다."
}
