{
  "id": "FR-COM-06-FE-04",
  "wbs": "5.6.4",
  "section": "커뮤니티 게시글·댓글·투표",
  "title": "선택지 선택 시 상품 가져오기 UI 구현",
  "phase": "개발",
  "category": "프론트엔드",
  "responsible": "",
  "assistants": [],
  "startDate": "2026-10-16",
  "endDate": "2026-10-20",
  "weight": 2,
  "progress": null,
  "status": "진행 전",
  "predecessorIds": [],
  "deliverables": [],
  "notes": "[난이도] weight=2; 복합 상태·트랜잭션·외부 서비스 연동 또는 여러 데이터 처리에 대한 개발자 추정.\n[판정] 제공된 완료 21개 목록에 없음. 부분 구현 37개와 구현 근거 없음 88개의 개별 ID는 제공되지 않아 세부 진척률은 미상. weight 전량을 일정에 반영.\n[계획] FE-08 병렬 작업 그룹(실제 담당자 미정). 배정 작업량: 2026-10-16: 1일; 2026-10-17: 0.5일; 2026-10-20: 0.5일. 시작=오전, 종료=오전. weight 1=1인일, 2=2인일; 10/17·10/24는 0.5일. 등록된 predecessorIds 기준 선행 과업은 전 근무일까지 완료하도록 배치.\n[일정 전제] 전체 미완료·판정불가 251개를 가용 인원 제한 없이 배치한 목표일정. 이 배치에는 FE 12개·BE 12개 병렬 작업 그룹이 필요하며, 실제 인력 배정 및 미등록 선행관계 검토 후 실행 가능 여부를 확정해야 함. 백엔드의 실제 기완료분은 작업량에서 차감되지 않음."
}
