{
  "id": "FR-ORD-01-BE-02",
  "wbs": "4.5.7",
  "section": "찜 장바구니 주문과 결제",
  "title": "가격 변동에 대비하여 주문 시점의 상품 정보(옵션, 수량, 가격)를 그대로 박제하는 스냅샷 저장 로직 구현",
  "phase": "개발",
  "category": "백엔드",
  "responsible": "주희",
  "assistants": [],
  "startDate": "2026-10-20",
  "endDate": "2026-10-22",
  "weight": 0.0020979020979020975,
  "status": "진행 전",
  "predecessorIds": [],
  "deliverables": [],
  "notes": "[판정] 프런트엔드 저장소만으로 백엔드 진행 상태 확인 불가. 일정 산정을 위해 작업량 전부를 임시 반영; 확인 후 조정 필요.\n[단계 일정] 주희 담당 영역 2단계: 찜·장바구니·주문과 결제. FE·BE 공통 작업 기간 2026-10-14~2026-10-30. 이전 영역의 진행 전 과업 종료 후 다음 영역 시작. 작업 배정: 2026-10-20: 0.5일; 2026-10-21: 1일; 2026-10-22: 0.5일. 시작=오후, 종료=오전. 10/17·10/24는 반일. 등록된 선행 과업은 전 근무일까지 완료.\n[일정 전제] 동일 영역 내 여러 과업을 병행하는 목표일정. 담당자는 백엔드 영역 책임자이며 1인당 동시 작업 한도는 적용하지 않음. weight 1=1인일, 2=2인일을 유지했으므로 실제 실행에는 추가 분담 또는 작업량·기간 조정이 필요함. 해당 영역 프론트 담당자: 승원. 기존 predecessorIds를 유지했으며 미등록 의존성 및 보류 과업 재개에 따른 일정은 별도 조정 대상.\n[책임자] 찜·장바구니·주문과 결제 백엔드 책임: 주희.",
  "effortScore": 3,
  "source": {
    "sheet": "기능별 구현 task",
    "row": 260,
    "category": "백엔드",
    "section": "찜 장바구니 주문과 결제 (승원, 주희)",
    "feature": "FR-ORD-01"
  }
}
