{
  "id": "FITZZA-116",
  "wbs": "FITZZA-116",
  "section": "FR-COM-06 커뮤니티 투표 게시글 작성 및 수정",
  "title": "투표 마감 및 게시글 수정 API",
  "phase": "FR-COM-06",
  "category": "백엔드",
  "responsible": "지현",
  "assistants": [],
  "startDate": "2026-10-15",
  "endDate": "2026-10-24",
  "weight": 0.002032749858836815,
  "status": "완료",
  "predecessorIds": [],
  "deliverables": [],
  "notes": "Jira FITZZA-116 (Done, 2026-10-14T01:35:55.3895190Z 조회). 기존 WBS 3개 작업의 가중치를 합산했습니다. 원본별 내역: data/jira-weight-audit.json. 날짜는 기존 작업의 최소 시작일·최대 종료일이며 Jira 계획일은 아닙니다."
}
