{
  "id": "FITZZA-43",
  "wbs": "FITZZA-43",
  "section": "FR-CAT-03 상품 상세",
  "title": "상품 옵션 및 실측 응답 구성",
  "phase": "FR-CAT-03",
  "category": "백엔드",
  "responsible": "주희",
  "assistants": [],
  "startDate": "2026-10-07",
  "endDate": "2026-10-12",
  "weight": 0.007792207792207792,
  "status": "진행 중",
  "predecessorIds": [],
  "deliverables": [],
  "notes": "Jira FITZZA-43 (In Progress, 2026-10-14T01:35:55.3895190Z 조회). 기존 WBS 2개 작업의 가중치를 합산했습니다. 원본별 내역: data/jira-weight-audit.json. 날짜는 기존 작업의 최소 시작일·최대 종료일이며 Jira 계획일은 아닙니다."
}
