{
  "id": "FITZZA-35",
  "wbs": "FITZZA-35",
  "section": "FR-CAT-01 상품 목록 확인",
  "title": "상품 목록 페이징 및 오류 처리",
  "phase": "FR-CAT-01",
  "category": "프론트엔드",
  "responsible": "준우",
  "assistants": [],
  "startDate": "2026-10-07",
  "endDate": "2026-10-08",
  "weight": 0.007499999999999999,
  "status": "검토 중",
  "predecessorIds": [],
  "deliverables": [],
  "notes": "Jira FITZZA-35 (In Review, 2026-10-14T01:35:55.3895190Z 조회). 기존 WBS 2개 작업의 가중치를 합산했습니다. 원본별 내역: data/jira-weight-audit.json. 날짜는 기존 작업의 최소 시작일·최대 종료일이며 Jira 계획일은 아닙니다."
}
