{
  "id": "FITZZA-66",
  "wbs": "FITZZA-66",
  "section": "FR-WISH-01 관심상품",
  "title": "관심상품 중복 요청 방어",
  "phase": "FR-WISH-01",
  "category": "백엔드",
  "responsible": "주희",
  "assistants": [],
  "startDate": "2026-10-14",
  "endDate": "2026-10-14",
  "weight": 0.00236013986013986,
  "status": "완료",
  "predecessorIds": [],
  "deliverables": [],
  "notes": "Jira FITZZA-66 (Done, 2026-10-14T01:35:55.3895190Z 조회). 기존 WBS 1개 작업의 가중치를 합산했습니다. 원본별 내역: data/jira-weight-audit.json. 날짜는 기존 작업의 최소 시작일·최대 종료일이며 Jira 계획일은 아닙니다."
}
